{
 "id": "he_47_pak36t",
 "name": "4.7 cm Sprgr. 36(t) (HE)",
 "kind": "he",
 "caliber_mm": 47.0,
 "mass_kg": 2.3,
 "muzzle_velocity_ms": 450.0,
 "explosive_mass_kg": 0.24,
 "explosive_type": "tnt",
 "penetrator_material": "steel",
 "length_mm": 188,
 "drag_coefficient": 0.42,
 "penetration_curve": [
  {
   "distance_m": 0,
   "pen_mm": 6.9
  },
  {
   "distance_m": 100,
   "pen_mm": 6.9
  },
  {
   "distance_m": 500,
   "pen_mm": 6.9
  },
  {
   "distance_m": 1000,
   "pen_mm": 6.9
  },
  {
   "distance_m": 1500,
   "pen_mm": 6.9
  },
  {
   "distance_m": 2000,
   "pen_mm": 6.9
  },
  {
   "distance_m": 2500,
   "pen_mm": 6.9
  }
 ],
 "ricochet_angle_deg": 79.0,
 "normalization_deg": 0.0,
 "fuse_delay_s": 0.0,
 "fuse_sensitivity_mm": 0.1
}
