{
 "id": "hei_35_kda",
 "name": "35 mm HEI-T (KDA)",
 "kind": "he",
 "caliber_mm": 35.0,
 "mass_kg": 0.55,
 "muzzle_velocity_ms": 1175.0,
 "explosive_mass_kg": 0.112,
 "explosive_type": "hexogen",
 "penetrator_material": "steel",
 "length_mm": 140,
 "drag_coefficient": 0.42,
 "penetration_curve": [
  {
   "distance_m": 0,
   "pen_mm": 4.7
  },
  {
   "distance_m": 100,
   "pen_mm": 4.7
  },
  {
   "distance_m": 500,
   "pen_mm": 4.7
  },
  {
   "distance_m": 1000,
   "pen_mm": 4.7
  },
  {
   "distance_m": 1500,
   "pen_mm": 4.7
  },
  {
   "distance_m": 2000,
   "pen_mm": 4.7
  },
  {
   "distance_m": 2500,
   "pen_mm": 4.7
  }
 ],
 "ricochet_angle_deg": 79.0,
 "normalization_deg": 0.0,
 "fuse_delay_s": 0.0,
 "fuse_sensitivity_mm": 0.1
}
