{
 "id": "aphe_85_br365",
 "name": "85 mm BR-365 (APHE)",
 "kind": "aphe",
 "caliber_mm": 85.0,
 "mass_kg": 9.2,
 "muzzle_velocity_ms": 792.0,
 "explosive_mass_kg": 0.164,
 "explosive_type": "tnt",
 "penetrator_material": "steel",
 "length_mm": 314,
 "drag_coefficient": 0.4,
 "penetration_curve": [
  {
   "distance_m": 0,
   "pen_mm": 139.5
  },
  {
   "distance_m": 100,
   "pen_mm": 136.5
  },
  {
   "distance_m": 500,
   "pen_mm": 125.2
  },
  {
   "distance_m": 1000,
   "pen_mm": 112.4
  },
  {
   "distance_m": 1500,
   "pen_mm": 100.9
  },
  {
   "distance_m": 2000,
   "pen_mm": 90.6
  },
  {
   "distance_m": 2500,
   "pen_mm": 81.3
  }
 ],
 "ricochet_angle_deg": 68.0,
 "normalization_deg": 5.0,
 "fuse_delay_s": 0.0024,
 "fuse_sensitivity_mm": 15
}
