{
 "id": "he_75_sprgr42",
 "name": "7.5 cm Sprgr. 42 (HE)",
 "kind": "he",
 "caliber_mm": 75.0,
 "mass_kg": 5.74,
 "muzzle_velocity_ms": 700.0,
 "explosive_mass_kg": 0.725,
 "explosive_type": "amatol",
 "penetrator_material": "steel",
 "length_mm": 300,
 "drag_coefficient": 0.42,
 "penetration_curve": [
  {
   "distance_m": 0,
   "pen_mm": 11.9
  },
  {
   "distance_m": 100,
   "pen_mm": 11.9
  },
  {
   "distance_m": 500,
   "pen_mm": 11.9
  },
  {
   "distance_m": 1000,
   "pen_mm": 11.9
  },
  {
   "distance_m": 1500,
   "pen_mm": 11.9
  },
  {
   "distance_m": 2000,
   "pen_mm": 11.9
  },
  {
   "distance_m": 2500,
   "pen_mm": 11.9
  }
 ],
 "ricochet_angle_deg": 79.0,
 "normalization_deg": 0.0,
 "fuse_delay_s": 0.0,
 "fuse_sensitivity_mm": 0.1
}
