{
 "id": "he_76_of350_l11",
 "name": "76 mm OF-350 (HE), L-11",
 "kind": "he",
 "caliber_mm": 76.2,
 "mass_kg": 6.2,
 "muzzle_velocity_ms": 625.0,
 "explosive_mass_kg": 0.71,
 "explosive_type": "tnt",
 "penetrator_material": "steel",
 "length_mm": 305,
 "drag_coefficient": 0.42,
 "penetration_curve": [
  {
   "distance_m": 0,
   "pen_mm": 11.8
  },
  {
   "distance_m": 100,
   "pen_mm": 11.8
  },
  {
   "distance_m": 500,
   "pen_mm": 11.8
  },
  {
   "distance_m": 1000,
   "pen_mm": 11.8
  },
  {
   "distance_m": 1500,
   "pen_mm": 11.8
  },
  {
   "distance_m": 2000,
   "pen_mm": 11.8
  },
  {
   "distance_m": 2500,
   "pen_mm": 11.8
  }
 ],
 "ricochet_angle_deg": 79.0,
 "normalization_deg": 0.0,
 "fuse_delay_s": 0.0,
 "fuse_sensitivity_mm": 0.1
}
